"Title","Description","Version","Release","BenchmarkDate","ReleaseInfo","Source","Notice","Rule_VulnID","Rule_RuleID","Rule_StigID","Rule_Severity","Rule_Cat","Rule_Classification","Rule_GroupTitle","Rule_RuleTitle","Rule_Description","Rule_VulnDiscussion","Rule_FalsePositives","Rule_FalseNegatives","Rule_Documentable","Rule_Mitigations","Rule_SeverityOverrideGuidance","Rule_PotentialImpacts","Rule_ThirdPartyTools","Rule_MitigationControl","Rule_Responsibility","Rule_IAControls","Rule_CheckText","Rule_FixText","Rule_CCI"
"Apache Server 2.4 Windows Site Security Technical Implementation Guide","This Security Technical Implementation Guide is published as a tool to improve the security of Department of Defense (DoD) information systems. The requirements are derived from the National Institute of Standards and Technology (NIST) 800-53 and related documents. Comments or proposed revisions to this document should be sent via email to the following address: disa.stig_spt@mail.mil.","2","1 ","27 Oct 2021","Release: 1 Benchmark Date: 27 Oct 2021","STIG.DOD.MIL","terms-of-use","V-214378","SV-214378r397735_rule","AS24-W2-000500","medium","CAT II","","SRG-APP-000224-WSR-000136","The Apache web server must generate unique session identifiers that cannot be reliably reproduced.","<VulnDiscussion>Communication between a client and the web server is done using the HTTP protocol, but HTTP is a stateless protocol. To maintain a connection or session, a web server will generate a session identifier (ID) for each client session when the session is initiated. The session ID allows the web server to track a user session and, in many cases, the user, if the user previously logged on to a hosted application.

By being able to guess session IDs, an attacker can easily perform a man-in-the-middle attack. To truly generate random session identifiers that cannot be reproduced, the web server session ID generator, when used twice with the same input criteria, must generate an unrelated random ID.

The session ID generator also needs to be a FIPS 140-2 approved generator.

Satisfies: SRG-APP-000224-WSR-000136, SRG-APP-000224-WSR-000137</VulnDiscussion><FalsePositives></FalsePositives><FalseNegatives></FalseNegatives><Documentable>false</Documentable><Mitigations></Mitigations><SeverityOverrideGuidance></SeverityOverrideGuidance><PotentialImpacts></PotentialImpacts><ThirdPartyTools></ThirdPartyTools><MitigationControl></MitigationControl><Responsibility></Responsibility><IAControls></IAControls>","Communication between a client and the web server is done using the HTTP protocol, but HTTP is a stateless protocol. To maintain a connection or session, a web server will generate a session identifier (ID) for each client session when the session is initiated. The session ID allows the web server to track a user session and, in many cases, the user, if the user previously logged on to a hosted application.

By being able to guess session IDs, an attacker can easily perform a man-in-the-middle attack. To truly generate random session identifiers that cannot be reproduced, the web server session ID generator, when used twice with the same input criteria, must generate an unrelated random ID.

The session ID generator also needs to be a FIPS 140-2 approved generator.

Satisfies: SRG-APP-000224-WSR-000136, SRG-APP-000224-WSR-000137","","","false","","","","","","","","Review the <'INSTALLED PATH'>\conf\httpd.conf file.

Verify the ""mod_unique_id"" is loaded.

If it does not exist, this is a finding.","Edit the <'INSTALLED PATH'>\conf\httpd.conf file and load the ""mod_unique_id"" module.

Restart Apache.","SV-102627,V-92539,CCI-001188"
"Apache Server 2.4 Windows Site Security Technical Implementation Guide","This Security Technical Implementation Guide is published as a tool to improve the security of Department of Defense (DoD) information systems. The requirements are derived from the National Institute of Standards and Technology (NIST) 800-53 and related documents. Comments or proposed revisions to this document should be sent via email to the following address: disa.stig_spt@mail.mil.","2","1 ","27 Oct 2021","Release: 1 Benchmark Date: 27 Oct 2021","STIG.DOD.MIL","terms-of-use","V-214379","SV-214379r397735_rule","AS24-W2-000520","medium","CAT II","","SRG-APP-000224-WSR-000138","The Apache web server must generate a session ID using as much of the character set as possible to reduce the risk of brute force.","<VulnDiscussion>Generating a session identifier (ID) that is not easily guessed through brute force is essential to deter several types of session attacks. By knowing the session ID, an attacker can hijack a user session that has already been user authenticated by the hosted application. The attacker does not need to guess user identifiers and passwords or have a secure token since the user session has already been authenticated.

By generating session IDs that contain as much of the character set as possible, i.e., A-Z, a-z, and 0-9, the session ID becomes exponentially harder to guess.</VulnDiscussion><FalsePositives></FalsePositives><FalseNegatives></FalseNegatives><Documentable>false</Documentable><Mitigations></Mitigations><SeverityOverrideGuidance></SeverityOverrideGuidance><PotentialImpacts></PotentialImpacts><ThirdPartyTools></ThirdPartyTools><MitigationControl></MitigationControl><Responsibility></Responsibility><IAControls></IAControls>","Generating a session identifier (ID) that is not easily guessed through brute force is essential to deter several types of session attacks. By knowing the session ID, an attacker can hijack a user session that has already been user authenticated by the hosted application. The attacker does not need to guess user identifiers and passwords or have a secure token since the user session has already been authenticated.

By generating session IDs that contain as much of the character set as possible, i.e., A-Z, a-z, and 0-9, the session ID becomes exponentially harder to guess.","","","false","","","","","","","","Review the <'INSTALLED PATH'>\conf\httpd.conf file.

Check to see if the ""mod_unique_id"" is loaded.

If it does not exist, this is a finding.","Edit the <'INSTALLED PATH'>\conf\httpd.conf file and load the ""mod_unique_id"" module.

Restart Apache.","SV-102631,V-92543,CCI-001188"
"Apache Server 2.4 Windows Site Security Technical Implementation Guide","This Security Technical Implementation Guide is published as a tool to improve the security of Department of Defense (DoD) information systems. The requirements are derived from the National Institute of Standards and Technology (NIST) 800-53 and related documents. Comments or proposed revisions to this document should be sent via email to the following address: disa.stig_spt@mail.mil.","2","1 ","27 Oct 2021","Release: 1 Benchmark Date: 27 Oct 2021","STIG.DOD.MIL","terms-of-use","V-214380","SV-214380r397738_rule","AS24-W2-000540","medium","CAT II","","SRG-APP-000225-WSR-000074","The Apache web server must augment re-creation to a stable and known baseline.","<VulnDiscussion>Making certain that the web server has not been updated by an unauthorized user is always a concern. Adding patches, functions, and modules that are untested and not part of the baseline opens the possibility for security risks. The web server must offer, and not hinder, a method that allows for the quick and easy reinstallation of a verified and patched baseline to guarantee the production web server is up-to-date and has not been modified to add functionality or expose security risks.

When the web server does not offer a method to roll back to a clean baseline, external methods, such as a baseline snapshot or virtualizing the web server, can be used.</VulnDiscussion><FalsePositives></FalsePositives><FalseNegatives></FalseNegatives><Documentable>false</Documentable><Mitigations></Mitigations><SeverityOverrideGuidance></SeverityOverrideGuidance><PotentialImpacts></PotentialImpacts><ThirdPartyTools></ThirdPartyTools><MitigationControl></MitigationControl><Responsibility></Responsibility><IAControls></IAControls>","Making certain that the web server has not been updated by an unauthorized user is always a concern. Adding patches, functions, and modules that are untested and not part of the baseline opens the possibility for security risks. The web server must offer, and not hinder, a method that allows for the quick and easy reinstallation of a verified and patched baseline to guarantee the production web server is up-to-date and has not been modified to add functionality or expose security risks.

When the web server does not offer a method to roll back to a clean baseline, external methods, such as a baseline snapshot or virtualizing the web server, can be used.","","","false","","","","","","","","Interview the System Administrator for the Apache web server.

Ask for documentation on the disaster recovery methods tested and planned for the Apache web server in the event of the necessity for rollback.

If documentation for a disaster recovery has not been established, this is a finding.","Prepare documentation for disaster recovery methods for the Apache web server in the event of the necessity for rollback.

Document and test the disaster recovery methods designed.","SV-102633,V-92545,CCI-001190"
"Apache Server 2.4 Windows Site Security Technical Implementation Guide","This Security Technical Implementation Guide is published as a tool to improve the security of Department of Defense (DoD) information systems. The requirements are derived from the National Institute of Standards and Technology (NIST) 800-53 and related documents. Comments or proposed revisions to this document should be sent via email to the following address: disa.stig_spt@mail.mil.","2","1 ","27 Oct 2021","Release: 1 Benchmark Date: 27 Oct 2021","STIG.DOD.MIL","terms-of-use","V-214381","SV-214381r397738_rule","AS24-W2-000560","medium","CAT II","","SRG-APP-000225-WSR-000141","The Apache web server must be configured to provide clustering.","<VulnDiscussion>The web server may host applications that display information that cannot be disrupted, such as information that is time critical or life threatening. In these cases, a web server that shuts down or ceases to be accessible when there is a failure is not acceptable. In these types of cases, clustering of web servers is used.

Clustering of multiple web servers is a common approach to providing fail-safe application availability. To ensure application availability, the web server must provide clustering or some form of failover functionality.

Satisfies: SRG-APP-000225-WSR-000141, SRG-APP-000356-WSR-000007</VulnDiscussion><FalsePositives></FalsePositives><FalseNegatives></FalseNegatives><Documentable>false</Documentable><Mitigations></Mitigations><SeverityOverrideGuidance></SeverityOverrideGuidance><PotentialImpacts></PotentialImpacts><ThirdPartyTools></ThirdPartyTools><MitigationControl></MitigationControl><Responsibility></Responsibility><IAControls></IAControls>","The web server may host applications that display information that cannot be disrupted, such as information that is time critical or life threatening. In these cases, a web server that shuts down or ceases to be accessible when there is a failure is not acceptable. In these types of cases, clustering of web servers is used.

Clustering of multiple web servers is a common approach to providing fail-safe application availability. To ensure application availability, the web server must provide clustering or some form of failover functionality.

Satisfies: SRG-APP-000225-WSR-000141, SRG-APP-000356-WSR-000007","","","false","","","","","","","","Review the <'INSTALLED PATH'>\conf\httpd.conf file.

Verify the ""mod_proxy"" is loaded.

If it does not exist, this is a finding.

If the ""mod_proxy"" module is loaded and the ""ProxyPass"" directive is not configured, this is a finding.","Edit the <'INSTALLED PATH'>\conf\httpd.conf file and load the ""mod_proxy"" module. 

Set the ""ProxyPass"" directive.","SV-102635,V-92547,CCI-001190,CCI-001844"
"Apache Server 2.4 Windows Site Security Technical Implementation Guide","This Security Technical Implementation Guide is published as a tool to improve the security of Department of Defense (DoD) information systems. The requirements are derived from the National Institute of Standards and Technology (NIST) 800-53 and related documents. Comments or proposed revisions to this document should be sent via email to the following address: disa.stig_spt@mail.mil.","2","1 ","27 Oct 2021","Release: 1 Benchmark Date: 27 Oct 2021","STIG.DOD.MIL","terms-of-use","V-214382","SV-214382r397747_rule","AS24-W2-000580","medium","CAT II","","SRG-APP-000233-WSR-000146","The Apache web server document directory must be in a separate partition from the Apache web servers system files.","<VulnDiscussion>A web server is used to deliver content on the request of a client. The content delivered to a client must be controlled, allowing only hosted application files to be accessed and delivered. To allow a client access to system files of any type is a major security risk that is entirely avoidable. Obtaining such access is the goal of directory traversal and URL manipulation vulnerabilities. To facilitate such access by misconfiguring the web document (home) directory is a serious error. In addition, having the path on the same drive as the system folder compounds potential attacks, such as drive space exhaustion.</VulnDiscussion><FalsePositives></FalsePositives><FalseNegatives></FalseNegatives><Documentable>false</Documentable><Mitigations></Mitigations><SeverityOverrideGuidance></SeverityOverrideGuidance><PotentialImpacts></PotentialImpacts><ThirdPartyTools></ThirdPartyTools><MitigationControl></MitigationControl><Responsibility></Responsibility><IAControls></IAControls>","A web server is used to deliver content on the request of a client. The content delivered to a client must be controlled, allowing only hosted application files to be accessed and delivered. To allow a client access to system files of any type is a major security risk that is entirely avoidable. Obtaining such access is the goal of directory traversal and URL manipulation vulnerabilities. To facilitate such access by misconfiguring the web document (home) directory is a serious error. In addition, having the path on the same drive as the system folder compounds potential attacks, such as drive space exhaustion.","","","false","","","","","","","","Determine whether the public web server has a two-way trusted relationship with any private asset located within the network. Private web server resources (e.g., drives, folders, printers, etc.) will not be directly mapped to or shared with public web servers.

If sharing is selected for any web folder, this is a finding.

If private resources (e.g., drives, partitions, folders/directories, printers, etc.) are shared with the public web server, this is a finding.","Configure the public web server to not have a trusted relationship with any system resource that is also not accessible to the public. Web content is not to be shared via Microsoft shares or NFS mounts.","SV-102637,V-92549,CCI-001084"
"Apache Server 2.4 Windows Site Security Technical Implementation Guide","This Security Technical Implementation Guide is published as a tool to improve the security of Department of Defense (DoD) information systems. The requirements are derived from the National Institute of Standards and Technology (NIST) 800-53 and related documents. Comments or proposed revisions to this document should be sent via email to the following address: disa.stig_spt@mail.mil.","2","1 ","27 Oct 2021","Release: 1 Benchmark Date: 27 Oct 2021","STIG.DOD.MIL","terms-of-use","V-214383","SV-214383r397843_rule","AS24-W2-000610","medium","CAT II","","SRG-APP-000266-WSR-000142","The Apache web server must display a default hosted application web page, not a directory listing, when a requested web page cannot be found.","<VulnDiscussion>The goal is to completely control the web user's experience in navigating any portion of the web document root directories. Ensuring all web content directories have at least the equivalent of an ""index.html"" file is a significant factor to accomplish this end.

Enumeration techniques, such as URL parameter manipulation, rely upon being able to obtain information about the web server's directory structure by locating directories without default pages. In the scenario, the web server will display to the user a listing of the files in the directory being accessed. By having a default hosted application web page, the anonymous web user will not obtain directory browsing information or an error message that reveals the server type and version.</VulnDiscussion><FalsePositives></FalsePositives><FalseNegatives></FalseNegatives><Documentable>false</Documentable><Mitigations></Mitigations><SeverityOverrideGuidance></SeverityOverrideGuidance><PotentialImpacts></PotentialImpacts><ThirdPartyTools></ThirdPartyTools><MitigationControl></MitigationControl><Responsibility></Responsibility><IAControls></IAControls>","The goal is to completely control the web user's experience in navigating any portion of the web document root directories. Ensuring all web content directories have at least the equivalent of an ""index.html"" file is a significant factor to accomplish this end.

Enumeration techniques, such as URL parameter manipulation, rely upon being able to obtain information about the web server's directory structure by locating directories without default pages. In the scenario, the web server will display to the user a listing of the files in the directory being accessed. By having a default hosted application web page, the anonymous web user will not obtain directory browsing information or an error message that reveals the server type and version.","","","false","","","","","","","","Review the DocumentRoot directive in the <'INSTALLED PATH'>\conf\httpd.conf file.

Note each location following the ""DocumentRoot"" string. This is the configured path(s) to the document root directory(s).

To view a list of the directories and sub-directories and the file ""index.html"", from each stated ""DocumentRoot"" location, enter the following command:

dir ""index.html""

Review the results for each document root directory and its subdirectories.

If a directory does not contain an ""index.html"" or equivalent default document, this is a finding.","Add a default document to the applicable directories.","SV-102641,V-92553,CCI-001312"
"Apache Server 2.4 Windows Site Security Technical Implementation Guide","This Security Technical Implementation Guide is published as a tool to improve the security of Department of Defense (DoD) information systems. The requirements are derived from the National Institute of Standards and Technology (NIST) 800-53 and related documents. Comments or proposed revisions to this document should be sent via email to the following address: disa.stig_spt@mail.mil.","2","1 ","27 Oct 2021","Release: 1 Benchmark Date: 27 Oct 2021","STIG.DOD.MIL","terms-of-use","V-214384","SV-214384r505106_rule","AS24-W2-000620","medium","CAT II","","SRG-APP-000266-WSR-000159","Warning and error messages displayed to clients must be modified to minimize the identity of the Apache web server, patches, loaded modules, and directory paths.","<VulnDiscussion>Information needed by an attacker to begin looking for possible vulnerabilities in a web server includes any information about the web server, backend systems being accessed, and plug-ins or modules being used.

Web servers will often display error messages to client users displaying enough information to aid in the debugging of the error. The information given back in error messages may display the web server type, version, patches installed, plug-ins and modules installed, type of code being used by the hosted application, and any backends being used for data storage.

This information could be used by an attacker to blueprint what type of attacks might be successful. The information given to users must be minimized to not aid in the blueprinting of the web server.</VulnDiscussion><FalsePositives></FalsePositives><FalseNegatives></FalseNegatives><Documentable>false</Documentable><Mitigations></Mitigations><SeverityOverrideGuidance></SeverityOverrideGuidance><PotentialImpacts></PotentialImpacts><ThirdPartyTools></ThirdPartyTools><MitigationControl></MitigationControl><Responsibility></Responsibility><IAControls></IAControls>","Information needed by an attacker to begin looking for possible vulnerabilities in a web server includes any information about the web server, backend systems being accessed, and plug-ins or modules being used.

Web servers will often display error messages to client users displaying enough information to aid in the debugging of the error. The information given back in error messages may display the web server type, version, patches installed, plug-ins and modules installed, type of code being used by the hosted application, and any backends being used for data storage.

This information could be used by an attacker to blueprint what type of attacks might be successful. The information given to users must be minimized to not aid in the blueprinting of the web server.","","","false","","","","","","","","Review the <'INSTALLED PATH'>\conf\httpd.conf file.

If the ""ErrorDocument"" directive is not being used, this is a finding.","Edit the <'INSTALLED PATH'>\conf\httpd.conf file and use the ""ErrorDocument"" directive to enable custom error pages.

ErrorDocument 500 ""Sorry, our script crashed. Oh dear""
ErrorDocument 500 /cgi-bin/crash-recover
ErrorDocument 500 http://error.example.com/server_error.html
ErrorDocument 404 /errors/not_found.html
ErrorDocument 401 /subscription/how_to_subscribe.html

The syntax of the ErrorDocument directive is:

ErrorDocument <3-digit-code> <action>

Additional Information:

https://httpd.apache.org/docs/2.4/custom-error.html","SV-102643,V-92555,CCI-001312"
"Apache Server 2.4 Windows Site Security Technical Implementation Guide","This Security Technical Implementation Guide is published as a tool to improve the security of Department of Defense (DoD) information systems. The requirements are derived from the National Institute of Standards and Technology (NIST) 800-53 and related documents. Comments or proposed revisions to this document should be sent via email to the following address: disa.stig_spt@mail.mil.","2","1 ","27 Oct 2021","Release: 1 Benchmark Date: 27 Oct 2021","STIG.DOD.MIL","terms-of-use","V-214385","SV-214385r397843_rule","AS24-W2-000630","medium","CAT II","","SRG-APP-000266-WSR-000160","Debugging and trace information used to diagnose the Apache web server must be disabled.","<VulnDiscussion>Information needed by an attacker to begin looking for possible vulnerabilities in a web server includes any information about the web server and plug-ins or modules being used. When debugging or trace information is enabled in a production web server, information about the web server, such as web server type, version, patches installed, plug-ins and modules installed, type of code being used by the hosted application, and any backends being used for data storage may be displayed. Since this information may be placed in logs and general messages during normal operation of the Apache web server, an attacker does not need to cause an error condition to gain this information.</VulnDiscussion><FalsePositives></FalsePositives><FalseNegatives></FalseNegatives><Documentable>false</Documentable><Mitigations></Mitigations><SeverityOverrideGuidance></SeverityOverrideGuidance><PotentialImpacts></PotentialImpacts><ThirdPartyTools></ThirdPartyTools><MitigationControl></MitigationControl><Responsibility></Responsibility><IAControls></IAControls>","Information needed by an attacker to begin looking for possible vulnerabilities in a web server includes any information about the web server and plug-ins or modules being used. When debugging or trace information is enabled in a production web server, information about the web server, such as web server type, version, patches installed, plug-ins and modules installed, type of code being used by the hosted application, and any backends being used for data storage may be displayed. Since this information may be placed in logs and general messages during normal operation of the Apache web server, an attacker does not need to cause an error condition to gain this information.","","","false","","","","","","","","Review the <'INSTALLED PATH'>\conf\httpd.conf file.

For any enabled ""TraceEnable"" directives, verify they are part of the server-level configuration (i.e., not nested in a ""Directory"" or ""Location"" directive).

Also, verify the ""TraceEnable"" directive is set to ""Off"".

If the ""TraceEnable"" directive is not part of the server-level configuration and/or is not set to ""Off"", this is a finding.

If the directive does not exist in the ""conf"" file, this is a finding because the default value is ""On"".","Edit the <'INSTALLED PATH'>\conf\httpd.conf file and add or set the value of ""EnableTrace"" to ""Off"".","SV-102645,V-92557,CCI-001312"
