"Title","Description","Version","Release","BenchmarkDate","ReleaseInfo","Source","Notice","Rule_VulnID","Rule_RuleID","Rule_StigID","Rule_Severity","Rule_Cat","Rule_Classification","Rule_GroupTitle","Rule_RuleTitle","Rule_Description","Rule_VulnDiscussion","Rule_FalsePositives","Rule_FalseNegatives","Rule_Documentable","Rule_Mitigations","Rule_SeverityOverrideGuidance","Rule_PotentialImpacts","Rule_ThirdPartyTools","Rule_MitigationControl","Rule_Responsibility","Rule_IAControls","Rule_CheckText","Rule_FixText","Rule_CCI"
"Apache Server 2.4 Windows Site Security Technical Implementation Guide","This Security Technical Implementation Guide is published as a tool to improve the security of Department of Defense (DoD) information systems. The requirements are derived from the National Institute of Standards and Technology (NIST) 800-53 and related documents. Comments or proposed revisions to this document should be sent via email to the following address: disa.stig_spt@mail.mil.","2","1 ","27 Oct 2021","Release: 1 Benchmark Date: 27 Oct 2021","STIG.DOD.MIL","terms-of-use","V-214370","SV-214370r505100_rule","AS24-W2-000380","medium","CAT II","","SRG-APP-000175-WSR-000095","The Apache web server must perform RFC 5280-compliant certification path validation.","<VulnDiscussion>A certificate's certification path is the path from the end entity certificate to a trusted root certification authority (CA). Certification path validation is necessary for a relying party to make an informed decision regarding acceptance of an end entity certificate. Certification path validation includes checks such as certificate issuer trust, time validity, and revocation status for each certificate in the certification path. Revocation status information for CA and subject certificates in a certification path is commonly provided via certificate revocation lists (CRLs) or online certificate status protocol (OCSP) responses.</VulnDiscussion><FalsePositives></FalsePositives><FalseNegatives></FalseNegatives><Documentable>false</Documentable><Mitigations></Mitigations><SeverityOverrideGuidance></SeverityOverrideGuidance><PotentialImpacts></PotentialImpacts><ThirdPartyTools></ThirdPartyTools><MitigationControl></MitigationControl><Responsibility></Responsibility><IAControls></IAControls>","A certificate's certification path is the path from the end entity certificate to a trusted root certification authority (CA). Certification path validation is necessary for a relying party to make an informed decision regarding acceptance of an end entity certificate. Certification path validation includes checks such as certificate issuer trust, time validity, and revocation status for each certificate in the certification path. Revocation status information for CA and subject certificates in a certification path is commonly provided via certificate revocation lists (CRLs) or online certificate status protocol (OCSP) responses.","","","false","","","","","","","","Review the <'INSTALLED PATH'>\conf\httpd.conf file to determine if the ""SSLVerifyClient"" and ""SSLVerifyDepth"" directives exist and look like the following.

If they do not, this is a finding.

SSLVerifyClient require

SSLVerifyDepth 1 

If ""SSLVerifyDepth"" is set to ""0"", this is a finding.","Ensure that client verification is enabled. For each enabled hosted application on the server, enable and set ""SSLVerifyClient"" to ""require"" and ensure that the server is configured to verify the client certificate by enabling ""SSLVerifyDepth"".
 
Example:
 
SSLVerifyClient require
 
Find the line ""SSLVerifyDepth"" and ensure it is set properly:
 
SSLVerifyDepth 1
 
""SSLVerifyDepth"" is set based on the number of CAs that are required in the certificate chain to check, before the client certificate is accepted as valid. A setting of ""0"" would allow self-signed CAs to validate client certificates, which is not desirable in this context.

Additional Information:

https://httpd.apache.org/docs/current/mod/mod_ssl.html","SV-102605,V-92517,CCI-000185"
"Apache Server 2.4 Windows Site Security Technical Implementation Guide","This Security Technical Implementation Guide is published as a tool to improve the security of Department of Defense (DoD) information systems. The requirements are derived from the National Institute of Standards and Technology (NIST) 800-53 and related documents. Comments or proposed revisions to this document should be sent via email to the following address: disa.stig_spt@mail.mil.","2","1 ","27 Oct 2021","Release: 1 Benchmark Date: 27 Oct 2021","STIG.DOD.MIL","terms-of-use","V-214371","SV-214371r397597_rule","AS24-W2-000390","medium","CAT II","","SRG-APP-000176-WSR-000096","Only authenticated system administrators or the designated PKI Sponsor for the Apache web server must have access to the Apache web servers private key.","<VulnDiscussion>The web server's private key is used to prove the identity of the server to clients and securely exchange the shared secret key used to encrypt communications between the web server and clients.

By gaining access to the private key, an attacker can pretend to be an authorized server and decrypt the SSL traffic between a client and the web server.</VulnDiscussion><FalsePositives></FalsePositives><FalseNegatives></FalseNegatives><Documentable>false</Documentable><Mitigations></Mitigations><SeverityOverrideGuidance></SeverityOverrideGuidance><PotentialImpacts></PotentialImpacts><ThirdPartyTools></ThirdPartyTools><MitigationControl></MitigationControl><Responsibility></Responsibility><IAControls></IAControls>","The web server's private key is used to prove the identity of the server to clients and securely exchange the shared secret key used to encrypt communications between the web server and clients.

By gaining access to the private key, an attacker can pretend to be an authorized server and decrypt the SSL traffic between a client and the web server.","","","false","","","","","","","","If the Apache web server does not have a private key, this is Not Applicable.

Review the private key path in the ""SSLCertificateFile"" directive. Verify only authenticated System Administrators and the designated PKI Sponsor for the web server can access the web server private key.

If the private key is accessible by unauthenticated or unauthorized users, this is a finding.","Configure the Apache web server to ensure only authenticated and authorized users can access the web server's private key.","SV-102607,V-92519,CCI-000186"
"Apache Server 2.4 Windows Site Security Technical Implementation Guide","This Security Technical Implementation Guide is published as a tool to improve the security of Department of Defense (DoD) information systems. The requirements are derived from the National Institute of Standards and Technology (NIST) 800-53 and related documents. Comments or proposed revisions to this document should be sent via email to the following address: disa.stig_spt@mail.mil.","2","1 ","27 Oct 2021","Release: 1 Benchmark Date: 27 Oct 2021","STIG.DOD.MIL","terms-of-use","V-214372","SV-214372r397711_rule","AS24-W2-000430","medium","CAT II","","SRG-APP-000211-WSR-000030","Apache web server accounts accessing the directory tree, the shell, or other operating system functions and utilities must only be administrative accounts.","<VulnDiscussion>As a rule, accounts on a web server are to be kept to a minimum. Only administrators, web managers, developers, auditors, and web authors require accounts on the machine hosting the web server. The resources to which these accounts have access must also be closely monitored and controlled. Only the system administrator needs access to all the system's capabilities, while the web administrator and associated staff require access and control of the web content and web server configuration files.</VulnDiscussion><FalsePositives></FalsePositives><FalseNegatives></FalseNegatives><Documentable>false</Documentable><Mitigations></Mitigations><SeverityOverrideGuidance></SeverityOverrideGuidance><PotentialImpacts></PotentialImpacts><ThirdPartyTools></ThirdPartyTools><MitigationControl></MitigationControl><Responsibility></Responsibility><IAControls></IAControls>","As a rule, accounts on a web server are to be kept to a minimum. Only administrators, web managers, developers, auditors, and web authors require accounts on the machine hosting the web server. The resources to which these accounts have access must also be closely monitored and controlled. Only the system administrator needs access to all the system's capabilities, while the web administrator and associated staff require access and control of the web content and web server configuration files.","","","false","","","","","","","","Review the web server documentation and configuration to determine what web server accounts are available on the server.

If any directories or files are owned by anyone other than root, this is a finding.

If non-privileged web server accounts are available with access to functions, directories, or files not needed for the role of the account, this is a finding.","Limit the functions, directories, and files that are accessible by each account and role to administrative accounts and remove or modify non-privileged account access.","SV-102615,V-92527,CCI-001082"
"Apache Server 2.4 Windows Site Security Technical Implementation Guide","This Security Technical Implementation Guide is published as a tool to improve the security of Department of Defense (DoD) information systems. The requirements are derived from the National Institute of Standards and Technology (NIST) 800-53 and related documents. Comments or proposed revisions to this document should be sent via email to the following address: disa.stig_spt@mail.mil.","2","1 ","27 Oct 2021","Release: 1 Benchmark Date: 27 Oct 2021","STIG.DOD.MIL","terms-of-use","V-214373","SV-214373r397711_rule","AS24-W2-000440","high","CAT I","","SRG-APP-000211-WSR-000031","Anonymous user access to the Apache web server application directories must be prohibited.","<VulnDiscussion>To properly monitor the changes to the web server and the hosted applications, logging must be enabled. Along with logging being enabled, each record must properly contain the changes made and the names of those who made the changes.

Allowing anonymous users the capability to change the web server or the hosted application will not generate proper log information that can then be used for forensic reporting in the case of a security issue. Allowing anonymous users to make changes will also grant change capabilities to anybody without forcing a user to authenticate before the changes can be made.

Satisfies: SRG-APP-000211-WSR-000031, SRG-APP-000380-WSR-000072</VulnDiscussion><FalsePositives></FalsePositives><FalseNegatives></FalseNegatives><Documentable>false</Documentable><Mitigations></Mitigations><SeverityOverrideGuidance></SeverityOverrideGuidance><PotentialImpacts></PotentialImpacts><ThirdPartyTools></ThirdPartyTools><MitigationControl></MitigationControl><Responsibility></Responsibility><IAControls></IAControls>","To properly monitor the changes to the web server and the hosted applications, logging must be enabled. Along with logging being enabled, each record must properly contain the changes made and the names of those who made the changes.

Allowing anonymous users the capability to change the web server or the hosted application will not generate proper log information that can then be used for forensic reporting in the case of a security issue. Allowing anonymous users to make changes will also grant change capabilities to anybody without forcing a user to authenticate before the changes can be made.

Satisfies: SRG-APP-000211-WSR-000031, SRG-APP-000380-WSR-000072","","","false","","","","","","","","Obtain a list of the user accounts for the system, noting the privileges for each account.

Verify with the System Administrator (SA) or the Information System Security Officer (ISSO) that all privileged accounts are mission essential and documented.

Verify with the SA or the ISSO that all non-administrator access to shell scripts and operating system functions are mission essential and documented.

If undocumented privileged accounts are present, this is a finding.

If undocumented access to shell scripts or operating system functions is present, this is a finding.","Ensure non-administrators are not allowed access to the directory tree, the shell, or other operating system functions and utilities.","SV-102617,V-92529,CCI-001082,CCI-001813"
"Apache Server 2.4 Windows Site Security Technical Implementation Guide","This Security Technical Implementation Guide is published as a tool to improve the security of Department of Defense (DoD) information systems. The requirements are derived from the National Institute of Standards and Technology (NIST) 800-53 and related documents. Comments or proposed revisions to this document should be sent via email to the following address: disa.stig_spt@mail.mil.","2","1 ","27 Oct 2021","Release: 1 Benchmark Date: 27 Oct 2021","STIG.DOD.MIL","terms-of-use","V-214374","SV-214374r397711_rule","AS24-W2-000450","medium","CAT II","","SRG-APP-000211-WSR-000129","The Apache web server must separate the hosted applications from hosted Apache web server management functionality.","<VulnDiscussion>The separation of user functionality from web server management can be accomplished by moving management functions to a separate IP address or port. To further separate the management functions, separate authentication methods and certificates should be used.

By moving the management functionality, the possibility of accidental discovery of the management functions by non-privileged users during hosted application use is minimized.</VulnDiscussion><FalsePositives></FalsePositives><FalseNegatives></FalseNegatives><Documentable>false</Documentable><Mitigations></Mitigations><SeverityOverrideGuidance></SeverityOverrideGuidance><PotentialImpacts></PotentialImpacts><ThirdPartyTools></ThirdPartyTools><MitigationControl></MitigationControl><Responsibility></Responsibility><IAControls></IAControls>","The separation of user functionality from web server management can be accomplished by moving management functions to a separate IP address or port. To further separate the management functions, separate authentication methods and certificates should be used.

By moving the management functionality, the possibility of accidental discovery of the management functions by non-privileged users during hosted application use is minimized.","","","false","","","","","","","","Review the web server documentation and deployed configuration to determine whether hosted application functionality is separated from web server management functions.

If the functions are not separated, this is a finding.","Configure Apache to separate the hosted applications from web server management functionality.","SV-102619,V-92531,CCI-001082"
"Apache Server 2.4 Windows Site Security Technical Implementation Guide","This Security Technical Implementation Guide is published as a tool to improve the security of Department of Defense (DoD) information systems. The requirements are derived from the National Institute of Standards and Technology (NIST) 800-53 and related documents. Comments or proposed revisions to this document should be sent via email to the following address: disa.stig_spt@mail.mil.","2","1 ","27 Oct 2021","Release: 1 Benchmark Date: 27 Oct 2021","STIG.DOD.MIL","terms-of-use","V-214375","SV-214375r803279_rule","AS24-W2-000460","medium","CAT II","","SRG-APP-000220-WSR-000201","The Apache web server must invalidate session identifiers upon hosted application user logout or other session termination.","<VulnDiscussion>Captured sessions can be reused in ""replay"" attacks. This requirement limits the ability of adversaries from capturing and continuing to employ previously valid session IDs.

Session IDs are tokens generated by web applications to uniquely identify an application user's session. Unique session IDs help to reduce predictability of said identifiers. When a user logs out, or when any other session termination event occurs, the web server must terminate the user session to minimize the potential for an attacker to hijack that particular user session.</VulnDiscussion><FalsePositives></FalsePositives><FalseNegatives></FalseNegatives><Documentable>false</Documentable><Mitigations></Mitigations><SeverityOverrideGuidance></SeverityOverrideGuidance><PotentialImpacts></PotentialImpacts><ThirdPartyTools></ThirdPartyTools><MitigationControl></MitigationControl><Responsibility></Responsibility><IAControls></IAControls>","Captured sessions can be reused in ""replay"" attacks. This requirement limits the ability of adversaries from capturing and continuing to employ previously valid session IDs.

Session IDs are tokens generated by web applications to uniquely identify an application user's session. Unique session IDs help to reduce predictability of said identifiers. When a user logs out, or when any other session termination event occurs, the web server must terminate the user session to minimize the potential for an attacker to hijack that particular user session.","","","false","","","","","","","","Working with the administrator, inspect the module used to invalidate sessions upon logout or other organizationally defined event (such as removing a CAC).

Verify the session max age in that module is set to ""1"".

If it does not exist, this is a finding.

If the session max age is not set to ""1"", this is a finding.

Alternative instruction:
Log in to the site using a test account.

Log out of the site.

Confirm the session and session ID were terminated and use of the website is no longer possible.

If use of the site is still possible after logging out, this is a finding.","Edit the .conf file and add or set the session max age to ""1"".

This conf file can vary depending on what type of logon session ID management is being leveraged.","V-92533,SV-102621,CCI-001185"
"Apache Server 2.4 Windows Site Security Technical Implementation Guide","This Security Technical Implementation Guide is published as a tool to improve the security of Department of Defense (DoD) information systems. The requirements are derived from the National Institute of Standards and Technology (NIST) 800-53 and related documents. Comments or proposed revisions to this document should be sent via email to the following address: disa.stig_spt@mail.mil.","2","1 ","27 Oct 2021","Release: 1 Benchmark Date: 27 Oct 2021","STIG.DOD.MIL","terms-of-use","V-214376","SV-214376r505103_rule","AS24-W2-000470","medium","CAT II","","SRG-APP-000223-WSR-000011","Cookies exchanged between the Apache web server and client, such as session cookies, must have security settings that disallow cookie access outside the originating Apache web server and hosted application.","<VulnDiscussion>Cookies are used to exchange data between the web server and the client. Cookies, such as a session cookie, may contain session information and user credentials used to maintain a persistent connection between the user and the hosted application since HTTP/HTTPS is a stateless protocol.

When the cookie parameters are not set properly (i.e., domain and path parameters), cookies can be shared within hosted applications residing on the same web server or to applications hosted on different web servers residing on the same domain.</VulnDiscussion><FalsePositives></FalsePositives><FalseNegatives></FalseNegatives><Documentable>false</Documentable><Mitigations></Mitigations><SeverityOverrideGuidance></SeverityOverrideGuidance><PotentialImpacts></PotentialImpacts><ThirdPartyTools></ThirdPartyTools><MitigationControl></MitigationControl><Responsibility></Responsibility><IAControls></IAControls>","Cookies are used to exchange data between the web server and the client. Cookies, such as a session cookie, may contain session information and user credentials used to maintain a persistent connection between the user and the hosted application since HTTP/HTTPS is a stateless protocol.

When the cookie parameters are not set properly (i.e., domain and path parameters), cookies can be shared within hosted applications residing on the same web server or to applications hosted on different web servers residing on the same domain.","","","false","","","","","","","","Review the <'INSTALLED PATH'>\conf\httpd.conf file.

If ""HttpOnly; secure"" is not configured, this is a finding.

Review the code. If when creating cookies, the following is not occurring, this is a finding:

function setCookie() { document.cookie = ""ALEPH_SESSION_ID = $SESS; path = /; secure""; }","Add this line to the ""httpd.conf"" file:

Header always edit Set-Cookie ^(.*)$ $1;HttpOnly;secure

Add the secure attribute to the JavaScript set cookie:

function setCookie() { document.cookie = ""ALEPH_SESSION_ID = $SESS; path = /; secure""; }

""HttpOnly"" cannot be used since by definition this is a cookie set by JavaScript.

Restart www_server and Apache.","SV-102623,V-92535,CCI-001664"
"Apache Server 2.4 Windows Site Security Technical Implementation Guide","This Security Technical Implementation Guide is published as a tool to improve the security of Department of Defense (DoD) information systems. The requirements are derived from the National Institute of Standards and Technology (NIST) 800-53 and related documents. Comments or proposed revisions to this document should be sent via email to the following address: disa.stig_spt@mail.mil.","2","1 ","27 Oct 2021","Release: 1 Benchmark Date: 27 Oct 2021","STIG.DOD.MIL","terms-of-use","V-214377","SV-214377r397732_rule","AS24-W2-000480","medium","CAT II","","SRG-APP-000223-WSR-000145","The Apache web server must accept only system-generated session identifiers.","<VulnDiscussion>Communication between a client and the web server is done using the HTTP protocol, but HTTP is a stateless protocol. To maintain a connection or session, a web server will generate a session identifier (ID) for each client session when the session is initiated. The session ID allows the web server to track a user session and, in many cases, the user, if the user previously logged on to a hosted application.

When a web server accepts session identifiers that are not generated by the web server, the web server creates an environment where session hijacking, such as session fixation, could be used to access hosted applications through session IDs that have already been authenticated. Forcing the web server to only accept web server-generated session IDs and to create new session IDs once a user is authenticated will limit session hijacking.</VulnDiscussion><FalsePositives></FalsePositives><FalseNegatives></FalseNegatives><Documentable>false</Documentable><Mitigations></Mitigations><SeverityOverrideGuidance></SeverityOverrideGuidance><PotentialImpacts></PotentialImpacts><ThirdPartyTools></ThirdPartyTools><MitigationControl></MitigationControl><Responsibility></Responsibility><IAControls></IAControls>","Communication between a client and the web server is done using the HTTP protocol, but HTTP is a stateless protocol. To maintain a connection or session, a web server will generate a session identifier (ID) for each client session when the session is initiated. The session ID allows the web server to track a user session and, in many cases, the user, if the user previously logged on to a hosted application.

When a web server accepts session identifiers that are not generated by the web server, the web server creates an environment where session hijacking, such as session fixation, could be used to access hosted applications through session IDs that have already been authenticated. Forcing the web server to only accept web server-generated session IDs and to create new session IDs once a user is authenticated will limit session hijacking.","","","false","","","","","","","","Review the <'INSTALL PATH'>\conf\httpd.conf file.

Verify the ""mod_unique_id"" is loaded.

If it does not exist, this is a finding.","Edit the <'INSTALL PATH'>\conf\httpd.conf file and load the ""mod_unique_id"" module.

Restart the Apache service.","SV-102625,V-92537,CCI-001664"
